{
  "$schema": "../schemas/release-a-corpus.schema.json",
  "schemaVersion": "1.0.0",
  "issue": 1705,
  "scope": "release_a_caption_only",
  "capturedAt": "2026-08-27T00:35:00+08:00",
  "requirements": {
    "videoCount": 20,
    "maxDurationSeconds": 900,
    "sourceLanguage": "en",
    "targetLanguage": "zh-Hant-TW",
    "mustBePublic": true,
    "mustBeNonLive": true,
    "mustBeEmbeddable": true,
    "mustHaveRetrievableEnglishCaptions": true,
    "allowedTranscriptSources": ["caption"],
    "audioDownloadsAllowed": false,
    "sttEnabled": false
  },
  "observationMethod": {
    "surface": "Visible YouTube search results UI",
    "officialHost": "https://www.youtube.com",
    "queries": [
      "https://www.youtube.com/results?search_query=TED-Ed+lessons",
      "https://www.youtube.com/results?search_query=TED-Ed+science+lessons"
    ],
    "observedSignals": [
      "normal watch URL visible in search results",
      "fixed duration label rather than a live badge",
      "English title/description",
      "visible captions badge",
      "verified TED or TED-Ed channel"
    ],
    "limitations": [
      "Search-page visibility is not the server preflight contract.",
      "status.embeddable, status.privacyStatus, snippet.liveBroadcastContent and snippet.defaultAudioLanguage were not read through videos.list.",
      "A captions badge does not prove that an approved provider can retrieve English caption text.",
      "No caption, translation, latency, synchronization or quality provider call was run."
    ]
  },
  "summary": {
    "candidateCount": 20,
    "verifiedCount": 0,
    "rejectedCount": 0,
    "maxObservedDurationSeconds": 646,
    "gateStatus": "blocked_candidates_only"
  },
  "videos": [
    {
      "ordinal": 1,
      "videoId": "wtovy-1-QUM",
      "url": "https://www.youtube.com/watch?v=wtovy-1-QUM",
      "title": "This is what happens in your brain when you can’t recall a word - Cella Wright",
      "channel": "TED-Ed",
      "observedDurationSeconds": 331,
      "observationQuery": 1,
      "status": "candidate",
      "observedSignals": {"searchVisible": true, "fixedDuration": true, "englishMetadata": true, "captionsBadge": true, "verifiedChannel": true},
      "unverifiedFields": ["privacyStatus", "liveBroadcastContent", "embeddable", "defaultAudioLanguage", "englishCaptionTextRetrievable"]
    },
    {
      "ordinal": 2,
      "videoId": "TjPFZaMe2yw",
      "url": "https://www.youtube.com/watch?v=TjPFZaMe2yw",
      "title": "3 tips on how to study effectively",
      "channel": "TED-Ed",
      "observedDurationSeconds": 309,
      "observationQuery": 1,
      "status": "candidate",
      "observedSignals": {"searchVisible": true, "fixedDuration": true, "englishMetadata": true, "captionsBadge": true, "verifiedChannel": true},
      "unverifiedFields": ["privacyStatus", "liveBroadcastContent", "embeddable", "defaultAudioLanguage", "englishCaptionTextRetrievable"]
    },
    {
      "ordinal": 3,
      "videoId": "7yDmGnA8Hw0",
      "url": "https://www.youtube.com/watch?v=7yDmGnA8Hw0",
      "title": "Can you solve the bridge riddle? - Alex Gendler",
      "channel": "TED-Ed",
      "observedDurationSeconds": 230,
      "observationQuery": 1,
      "status": "candidate",
      "observedSignals": {"searchVisible": true, "fixedDuration": true, "englishMetadata": true, "captionsBadge": true, "verifiedChannel": true},
      "unverifiedFields": ["privacyStatus", "liveBroadcastContent", "embeddable", "defaultAudioLanguage", "englishCaptionTextRetrievable"]
    },
    {
      "ordinal": 4,
      "videoId": "8Z9FQxcCAZ0",
      "url": "https://www.youtube.com/watch?v=8Z9FQxcCAZ0",
      "title": "Everything you need to know to read Homer's Odyssey - Jill Dash",
      "channel": "TED-Ed",
      "observedDurationSeconds": 297,
      "observationQuery": 1,
      "status": "candidate",
      "observedSignals": {"searchVisible": true, "fixedDuration": true, "englishMetadata": true, "captionsBadge": true, "verifiedChannel": true},
      "unverifiedFields": ["privacyStatus", "liveBroadcastContent", "embeddable", "defaultAudioLanguage", "englishCaptionTextRetrievable"]
    },
    {
      "ordinal": 5,
      "videoId": "JAyuHIthHco",
      "url": "https://www.youtube.com/watch?v=JAyuHIthHco",
      "title": "What would happen if everyone stopped eating meat tomorrow? - Carolyn Beans",
      "channel": "TED-Ed",
      "observedDurationSeconds": 277,
      "observationQuery": 1,
      "status": "candidate",
      "observedSignals": {"searchVisible": true, "fixedDuration": true, "englishMetadata": true, "captionsBadge": true, "verifiedChannel": true},
      "unverifiedFields": ["privacyStatus", "liveBroadcastContent", "embeddable", "defaultAudioLanguage", "englishCaptionTextRetrievable"]
    },
    {
      "ordinal": 6,
      "videoId": "7K3KdgDcdYc",
      "url": "https://www.youtube.com/watch?v=7K3KdgDcdYc",
      "title": "How did ancient civilizations make ice cream? - Vivian Jiang",
      "channel": "TED-Ed",
      "observedDurationSeconds": 295,
      "observationQuery": 1,
      "status": "candidate",
      "observedSignals": {"searchVisible": true, "fixedDuration": true, "englishMetadata": true, "captionsBadge": true, "verifiedChannel": true},
      "unverifiedFields": ["privacyStatus", "liveBroadcastContent", "embeddable", "defaultAudioLanguage", "englishCaptionTextRetrievable"]
    },
    {
      "ordinal": 7,
      "videoId": "CqgmozFr_GM",
      "url": "https://www.youtube.com/watch?v=CqgmozFr_GM",
      "title": "How to stay calm under pressure - Noa Kageyama and Pen-Pen Chen",
      "channel": "TED-Ed",
      "observedDurationSeconds": 269,
      "observationQuery": 1,
      "status": "candidate",
      "observedSignals": {"searchVisible": true, "fixedDuration": true, "englishMetadata": true, "captionsBadge": true, "verifiedChannel": true},
      "unverifiedFields": ["privacyStatus", "liveBroadcastContent", "embeddable", "defaultAudioLanguage", "englishCaptionTextRetrievable"]
    },
    {
      "ordinal": 8,
      "videoId": "l_NYrWqUR40",
      "url": "https://www.youtube.com/watch?v=l_NYrWqUR40",
      "title": "3 tips to boost your confidence - TED-Ed",
      "channel": "TED-Ed",
      "observedDurationSeconds": 257,
      "observationQuery": 1,
      "status": "candidate",
      "observedSignals": {"searchVisible": true, "fixedDuration": true, "englishMetadata": true, "captionsBadge": true, "verifiedChannel": true},
      "unverifiedFields": ["privacyStatus", "liveBroadcastContent", "embeddable", "defaultAudioLanguage", "englishCaptionTextRetrievable"]
    },
    {
      "ordinal": 9,
      "videoId": "XFhY4Vy3IHc",
      "url": "https://www.youtube.com/watch?v=XFhY4Vy3IHc",
      "title": "Why is English so confusing? - Arika Okrent",
      "channel": "TED-Ed",
      "observedDurationSeconds": 334,
      "observationQuery": 1,
      "status": "candidate",
      "observedSignals": {"searchVisible": true, "fixedDuration": true, "englishMetadata": true, "captionsBadge": true, "verifiedChannel": true},
      "unverifiedFields": ["privacyStatus", "liveBroadcastContent", "embeddable", "defaultAudioLanguage", "englishCaptionTextRetrievable"]
    },
    {
      "ordinal": 10,
      "videoId": "idrbwnWLJ7w",
      "url": "https://www.youtube.com/watch?v=idrbwnWLJ7w",
      "title": "What staying up all night does to your brain - Anna Rothschild",
      "channel": "TED-Ed",
      "observedDurationSeconds": 337,
      "observationQuery": 1,
      "status": "candidate",
      "observedSignals": {"searchVisible": true, "fixedDuration": true, "englishMetadata": true, "captionsBadge": true, "verifiedChannel": true},
      "unverifiedFields": ["privacyStatus", "liveBroadcastContent", "embeddable", "defaultAudioLanguage", "englishCaptionTextRetrievable"]
    },
    {
      "ordinal": 11,
      "videoId": "o_XVt5rdpFY",
      "url": "https://www.youtube.com/watch?v=o_XVt5rdpFY",
      "title": "The secrets of learning a new language | Lýdia Machová | TED",
      "channel": "TED",
      "observedDurationSeconds": 646,
      "observationQuery": 1,
      "status": "candidate",
      "observedSignals": {"searchVisible": true, "fixedDuration": true, "englishMetadata": true, "captionsBadge": true, "verifiedChannel": true},
      "unverifiedFields": ["privacyStatus", "liveBroadcastContent", "embeddable", "defaultAudioLanguage", "englishCaptionTextRetrievable"]
    },
    {
      "ordinal": 12,
      "videoId": "jLOuMXnM5wk",
      "url": "https://www.youtube.com/watch?v=jLOuMXnM5wk",
      "title": "The best way to become good at something might surprise you - David Epstein",
      "channel": "TED-Ed",
      "observedDurationSeconds": 346,
      "observationQuery": 1,
      "status": "candidate",
      "observedSignals": {"searchVisible": true, "fixedDuration": true, "englishMetadata": true, "captionsBadge": true, "verifiedChannel": true},
      "unverifiedFields": ["privacyStatus", "liveBroadcastContent", "embeddable", "defaultAudioLanguage", "englishCaptionTextRetrievable"]
    },
    {
      "ordinal": 13,
      "videoId": "iDbdXTMnOmE",
      "url": "https://www.youtube.com/watch?v=iDbdXTMnOmE",
      "title": "How to manage your time more effectively (according to machines) - Brian Christian",
      "channel": "TED-Ed",
      "observedDurationSeconds": 310,
      "observationQuery": 1,
      "status": "candidate",
      "observedSignals": {"searchVisible": true, "fixedDuration": true, "englishMetadata": true, "captionsBadge": true, "verifiedChannel": true},
      "unverifiedFields": ["privacyStatus", "liveBroadcastContent", "embeddable", "defaultAudioLanguage", "englishCaptionTextRetrievable"]
    },
    {
      "ordinal": 14,
      "videoId": "R0JKCYZ8hng",
      "url": "https://www.youtube.com/watch?v=R0JKCYZ8hng",
      "title": "How playing an instrument benefits your brain - Anita Collins",
      "channel": "TED-Ed",
      "observedDurationSeconds": 285,
      "observationQuery": 1,